{"catalogVersion":2,"generatedAt":"2026-10-23T09:24:29.140Z","keyId":"c212985bff94fe74d2416b24aa980d0736ffeb9b65ec15a0af7c1bc2daaaf5b2","plugins":[{"id":"nextprob.export-bulk","metadata":{"categories":["export"],"displayName":"Export Bulk","documentation":"README.md","license":"AGPL-3.0-only","publisher":"nextprob","releaseNotes":"Initial registry release.","source":"https://github.com/NextProb/nextprob-plugin-registry/tree/main/plugins/nextprob.export-bulk","summary":"Exports a folder or workspace of notes into a single ZIP archive as HTML, PDF, Markdown, or plain text."},"official":true,"publisher":{"displayName":"NextProb","github":["toutkit"],"id":"nextprob","official":true,"url":"https://github.com/NextProb"},"versions":[{"apiVersion":1,"assets":[{"filename":"nextprob.export-bulk-1.0.0.zip","platforms":["darwin-arm64","darwin-x64","linux-arm64","linux-x64","win32-arm64","win32-x64"],"sha256":"244d0f1adbe497f183f7568444dee8043c34e66ae47ff997cb6bc214653632d9","size":4482125,"url":"https://github.com/NextProb/nextprob-plugin-registry/releases/download/nextprob.export-bulk-v1.0.0/nextprob.export-bulk-1.0.0.zip"}],"dependencies":[{"id":"nextprob.export-engine","range":">=1.0.0 <2.0.0"},{"id":"nextprob.export-html","range":">=1.0.0 <2.0.0"},{"id":"nextprob.export-pdf","range":">=1.0.0 <2.0.0"},{"id":"nextprob.export-markdown","range":">=1.0.0 <2.0.0"},{"id":"nextprob.export-plaintext","range":">=1.0.0 <2.0.0"}],"deprecated":false,"execution":"native","nextprob":">=0.4.0 <1.0.0","platforms":["darwin-arm64","darwin-x64","linux-arm64","linux-x64","win32-arm64","win32-x64"],"publishedAt":"2026-10-23T09:24:29.140Z","releaseNotes":"Initial registry release.","releaseTag":"nextprob.export-bulk-v1.0.0","sourceCommit":"b3bbf264faa7b391d2ea12a64a560b2e60ca5128","version":"1.0.0","withdrawn":false}]},{"id":"nextprob.export-engine","metadata":{"categories":["export"],"displayName":"Export Engine","documentation":"README.md","license":"AGPL-3.0-only","publisher":"nextprob","releaseNotes":"Initial registry release.","source":"https://github.com/NextProb/nextprob-plugin-registry/tree/main/plugins/nextprob.export-engine","summary":"Provides shared export tools and the export menu used by other extensions."},"official":true,"publisher":{"displayName":"NextProb","github":["toutkit"],"id":"nextprob","official":true,"url":"https://github.com/NextProb"},"versions":[{"apiVersion":1,"assets":[{"filename":"nextprob.export-engine-1.0.0.zip","platforms":["darwin-arm64","darwin-x64","linux-arm64","linux-x64","win32-arm64","win32-x64"],"sha256":"ea1b076ebcc468206bea1be83b4fa0f44b1cf20d59a36fec9a41bbe6deacfd99","size":17688,"url":"https://github.com/NextProb/nextprob-plugin-registry/releases/download/nextprob.export-engine-v1.0.0/nextprob.export-engine-1.0.0.zip"}],"dependencies":[],"deprecated":false,"execution":"native","nextprob":">=0.4.0 <1.0.0","platforms":["darwin-arm64","darwin-x64","linux-arm64","linux-x64","win32-arm64","win32-x64"],"publishedAt":"2026-10-23T07:31:11.457Z","releaseNotes":"Initial registry release.","releaseTag":"nextprob.export-engine-v1.0.0","sourceCommit":"aba9bc3c5c56120a12ea5b91c1e0403875390ce2","version":"1.0.0","withdrawn":false}]},{"id":"nextprob.export-html","metadata":{"categories":["export"],"displayName":"Export HTML","documentation":"README.md","license":"AGPL-3.0-only","publisher":"nextprob","releaseNotes":"Initial registry release.","source":"https://github.com/NextProb/nextprob-plugin-registry/tree/main/plugins/nextprob.export-html","summary":"Saves notes as HTML files, including a single self-contained file with inlined styles, scripts, and media."},"official":true,"publisher":{"displayName":"NextProb","github":["toutkit"],"id":"nextprob","official":true,"url":"https://github.com/NextProb"},"versions":[{"apiVersion":1,"assets":[{"filename":"nextprob.export-html-1.0.0.zip","platforms":["darwin-arm64","darwin-x64","linux-arm64","linux-x64","win32-arm64","win32-x64"],"sha256":"aed9ac2595f468fab2ffd376c0a9f9708ee9e1aaa61289b62f9f0c965074c915","size":18928,"url":"https://github.com/NextProb/nextprob-plugin-registry/releases/download/nextprob.export-html-v1.0.0/nextprob.export-html-1.0.0.zip"}],"dependencies":[{"id":"nextprob.export-engine","range":">=1.0.0 <2.0.0"}],"deprecated":false,"execution":"native","nextprob":">=0.4.0 <1.0.0","platforms":["darwin-arm64","darwin-x64","linux-arm64","linux-x64","win32-arm64","win32-x64"],"publishedAt":"2026-10-23T09:24:29.140Z","releaseNotes":"Initial registry release.","releaseTag":"nextprob.export-html-v1.0.0","sourceCommit":"b3bbf264faa7b391d2ea12a64a560b2e60ca5128","version":"1.0.0","withdrawn":false}]},{"id":"nextprob.export-markdown","metadata":{"categories":["export"],"displayName":"Export Markdown","documentation":"README.md","license":"AGPL-3.0-only","publisher":"nextprob","releaseNotes":"Initial registry release.","source":"https://github.com/NextProb/nextprob-plugin-registry/tree/main/plugins/nextprob.export-markdown","summary":"Converts notes to portable Markdown files."},"official":true,"publisher":{"displayName":"NextProb","github":["toutkit"],"id":"nextprob","official":true,"url":"https://github.com/NextProb"},"versions":[{"apiVersion":1,"assets":[{"filename":"nextprob.export-markdown-1.0.0.zip","platforms":["darwin-arm64","darwin-x64","linux-arm64","linux-x64","win32-arm64","win32-x64"],"sha256":"11d57f5ab5005b91663c06ac47349cbc97d504547ae5b69d77eb9a001714f074","size":2318126,"url":"https://github.com/NextProb/nextprob-plugin-registry/releases/download/nextprob.export-markdown-v1.0.0/nextprob.export-markdown-1.0.0.zip"}],"dependencies":[{"id":"nextprob.export-engine","range":">=1.0.0 <2.0.0"}],"deprecated":false,"execution":"native","nextprob":">=0.4.0 <1.0.0","platforms":["darwin-arm64","darwin-x64","linux-arm64","linux-x64","win32-arm64","win32-x64"],"publishedAt":"2026-10-23T07:31:11.457Z","releaseNotes":"Initial registry release.","releaseTag":"nextprob.export-markdown-v1.0.0","sourceCommit":"aba9bc3c5c56120a12ea5b91c1e0403875390ce2","version":"1.0.0","withdrawn":false}]},{"id":"nextprob.export-pdf","metadata":{"categories":["export"],"displayName":"Export PDF","documentation":"README.md","license":"AGPL-3.0-only","publisher":"nextprob","releaseNotes":"Initial registry release.","source":"https://github.com/NextProb/nextprob-plugin-registry/tree/main/plugins/nextprob.export-pdf","summary":"Saves notes as PDF documents rendered by the app's own Chromium print pipeline."},"official":true,"publisher":{"displayName":"NextProb","github":["toutkit"],"id":"nextprob","official":true,"url":"https://github.com/NextProb"},"versions":[{"apiVersion":1,"assets":[{"filename":"nextprob.export-pdf-1.0.0.zip","platforms":["darwin-arm64","darwin-x64","linux-arm64","linux-x64","win32-arm64","win32-x64"],"sha256":"2056496f45490ca44abd2f868093b94189271cde958f4f5aaa1f0617413e5db6","size":16914,"url":"https://github.com/NextProb/nextprob-plugin-registry/releases/download/nextprob.export-pdf-v1.0.0/nextprob.export-pdf-1.0.0.zip"}],"dependencies":[{"id":"nextprob.export-engine","range":">=1.0.0 <2.0.0"}],"deprecated":false,"execution":"native","nextprob":">=0.4.0 <1.0.0","platforms":["darwin-arm64","darwin-x64","linux-arm64","linux-x64","win32-arm64","win32-x64"],"publishedAt":"2026-10-23T09:24:29.140Z","releaseNotes":"Initial registry release.","releaseTag":"nextprob.export-pdf-v1.0.0","sourceCommit":"b3bbf264faa7b391d2ea12a64a560b2e60ca5128","version":"1.0.0","withdrawn":false}]},{"id":"nextprob.export-plaintext","metadata":{"categories":["export"],"displayName":"Export Plain Text","documentation":"README.md","license":"AGPL-3.0-only","publisher":"nextprob","releaseNotes":"Initial registry release.","source":"https://github.com/NextProb/nextprob-plugin-registry/tree/main/plugins/nextprob.export-plaintext","summary":"Saves the text of your notes as plain text files, preserving headings, lists, tables, and code block whitespace."},"official":true,"publisher":{"displayName":"NextProb","github":["toutkit"],"id":"nextprob","official":true,"url":"https://github.com/NextProb"},"versions":[{"apiVersion":1,"assets":[{"filename":"nextprob.export-plaintext-1.0.0.zip","platforms":["darwin-arm64","darwin-x64","linux-arm64","linux-x64","win32-arm64","win32-x64"],"sha256":"06d39b6fd8183ae840f8a6dddfd19d1170f656066a042413a34522ff131f7ef4","size":17572,"url":"https://github.com/NextProb/nextprob-plugin-registry/releases/download/nextprob.export-plaintext-v1.0.0/nextprob.export-plaintext-1.0.0.zip"}],"dependencies":[{"id":"nextprob.export-engine","range":">=1.0.0 <2.0.0"}],"deprecated":false,"execution":"native","nextprob":">=0.4.0 <1.0.0","platforms":["darwin-arm64","darwin-x64","linux-arm64","linux-x64","win32-arm64","win32-x64"],"publishedAt":"2026-10-23T09:24:29.140Z","releaseNotes":"Initial registry release.","releaseTag":"nextprob.export-plaintext-v1.0.0","sourceCommit":"b3bbf264faa7b391d2ea12a64a560b2e60ca5128","version":"1.0.0","withdrawn":false}]},{"id":"nextprob.publishing","metadata":{"categories":["publishing"],"displayName":"Publishing","documentation":"README.md","license":"AGPL-3.0-only","publisher":"nextprob","releaseNotes":"Initial marketplace release. Publish as a Link is self-contained and no longer depends on HTML Export or Export Engine.","source":"https://github.com/NextProb/nextprob-plugin-registry/tree/main/plugins/nextprob.publishing","summary":"Publishes notes as self-contained GitHub-backed links, with no export plugin or first-use download required."},"official":true,"publisher":{"displayName":"NextProb","github":["toutkit"],"id":"nextprob","official":true,"url":"https://github.com/NextProb"},"versions":[{"apiVersion":1,"assets":[{"filename":"nextprob.publishing-1.0.0.zip","platforms":["darwin-arm64","darwin-x64","linux-arm64","linux-x64","win32-arm64","win32-x64"],"sha256":"4683e9860d68018436fb7d8c617f6e8468ee3749cf0f491b2805b72022e3820d","size":38538,"url":"https://github.com/NextProb/nextprob-plugin-registry/releases/download/nextprob.publishing-v1.0.0/nex